{
  "run_id": "dev-run",
  "signal_id": "responsibility_evasion",
  "signal_version": "1.0.0",
  "tier": "B",
  "dataset_scope": {
    "items_analyzed": 512,
    "time_min": "2026-02-06T16:28:35",
    "time_max": "2026-02-07T01:20:51+00:00",
    "surfaces": [
      "fb_extract_out/sean_context_enriched.jsonl"
    ]
  },
  "metrics": {
    "responsibility_evasion_count": 0,
    "responsibility_evasion_rate_per_100": 0.0,
    "responsibility_evasion_over_time": {}
  },
  "examples": [],
  "fingerprints": {
    "input_fingerprint": "fb7525e60ee3d35e",
    "spec_fingerprint": "23d4d1deb5f07264",
    "generated_utc": "2026-02-07T17:10:49.111598+00:00"
  }
}